{
  "canvas": {
    "width": 512,
    "height": 512
  },
  "strokes": [
    {
      "id": "p0",
      "points": [
        [
          360.79,
          216.92
        ],
        [
          355.85,
          226.95
        ],
        [
          350.4,
          236.72
        ],
        [
          340.14,
          244.67
        ],
        [
          325.93,
          245.2
        ],
        [
          312.65,
          242.86
        ],
        [
          300.34,
          237.63
        ],
        [
          294.22,
          227.55
        ],
        [
          292.58,
          216.92
        ],
        [
          292.24,
          205.62
        ],
        [
          302.77,
          198.17
        ],
        [
          311.87,
          189.44
        ],
        [
          325.93,
          187.2
        ],
        [
          339.27,
          190.85
        ],
        [
          350.46,
          197.06
        ],
        [
          355.67,
          206.94
        ]
      ],
      "closed": true,
      "color": "#E76F51",
      "pressure": null
    },
    {
      "id": "p1",
      "points": [
        [
          333.99,
          278.21
        ],
        [
          330.42,
          289.13
        ],
        [
          320.01,
          296.86
        ],
        [
          309.84,
          305.0
        ],
        [
          294.88,
          308.4
        ],
        [
          279.59,
          305.62
        ],
        [
          267.5,
          298.53
        ],
        [
          260.33,
          288.83
        ],
        [
          257.62,
          278.21
        ],
        [
          261.96,
          268.09
        ],
        [
          270.17,
          259.86
        ],
        [
          279.37,
          250.4
        ],
        [
          294.88,
          250.67
        ],
        [
          309.06,
          252.8
        ],
        [
          321.49,
          258.46
        ],
        [
          332.43,
          266.66
        ]
      ],
      "closed": true,
      "color": "#E76F51",
      "pressure": null
    },
    {
      "id": "p2",
      "points": [
        [
          254.68,
          277.52
        ],
        [
          250.34,
          288.28
        ],
        [
          242.82,
          297.79
        ],
        [
          230.89,
          304.61
        ],
        [
          216.1,
          306.26
        ],
        [
          203.0,
          301.52
        ],
        [
          190.16,
          297.21
        ],
        [
          181.54,
          288.38
        ],
        [
          178.19,
          277.52
        ],
        [
          179.66,
          266.06
        ],
        [
          188.83,
          256.82
        ],
        [
          202.17,
          251.99
        ],
        [
          216.1,
          249.61
        ],
        [
          230.86,
          250.49
        ],
        [
          243.27,
          256.91
        ],
        [
          249.44,
          267.04
        ]
      ],
      "closed": true,
      "color": "#E76F51",
      "pressure": null
    },
    {
      "id": "p3",
      "points": [
        [
          222.1,
          221.45
        ],
        [
          220.28,
          232.45
        ],
        [
          213.0,
          242.37
        ],
        [
          199.65,
          246.98
        ],
        [
          186.01,
          249.8
        ],
        [
          172.86,
          246.08
        ],
        [
          159.2,
          242.24
        ],
        [
          151.59,
          232.5
        ],
        [
          149.29,
          221.45
        ],
        [
          153.51,
          211.01
        ],
        [
          162.15,
          202.95
        ],
        [
          172.75,
          196.61
        ],
        [
          186.01,
          194.51
        ],
        [
          200.43,
          194.47
        ],
        [
          211.87,
          201.41
        ],
        [
          221.27,
          210.13
        ]
      ],
      "closed": true,
      "color": "#E76F51",
      "pressure": null
    },
    {
      "id": "p4",
      "points": [
        [
          257.21,
          156.6
        ],
        [
          257.62,
          167.7
        ],
        [
          249.18,
          176.17
        ],
        [
          239.51,
          183.84
        ],
        [
          226.33,
          184.36
        ],
        [
          214.37,
          181.34
        ],
        [
          201.58,
          177.8
        ],
        [
          194.95,
          167.73
        ],
        [
          192.09,
          156.6
        ],
        [
          195.15,
          145.53
        ],
        [
          201.55,
          135.37
        ],
        [
          213.07,
          129.17
        ],
        [
          226.33,
          130.53
        ],
        [
          238.0,
          132.48
        ],
        [
          247.75,
          138.25
        ],
        [
          257.71,
          145.46
        ]
      ],
      "closed": true,
      "color": "#E76F51",
      "pressure": null
    },
    {
      "id": "p5",
      "points": [
        [
          325.69,
          159.37
        ],
        [
          323.48,
          169.53
        ],
        [
          318.82,
          180.38
        ],
        [
          305.46,
          185.74
        ],
        [
          290.98,
          185.82
        ],
        [
          277.65,
          183.66
        ],
        [
          263.49,
          180.12
        ],
        [
          254.85,
          170.67
        ],
        [
          256.18,
          159.37
        ],
        [
          254.08,
          147.83
        ],
        [
          266.34,
          140.77
        ],
        [
          277.04,
          133.95
        ],
        [
          290.98,
          130.82
        ],
        [
          305.89,
          132.21
        ],
        [
          318.8,
          138.38
        ],
        [
          322.63,
          149.48
        ]
      ],
      "closed": true,
      "color": "#E76F51",
      "pressure": null
    },
    {
      "id": "center",
      "points": [
        [
          282.89,
          220.0
        ],
        [
          280.37,
          230.09
        ],
        [
          274.46,
          238.46
        ],
        [
          267.01,
          246.57
        ],
        [
          256.0,
          246.4
        ],
        [
          245.42,
          245.54
        ],
        [
          235.63,
          240.37
        ],
        [
          228.98,
          231.19
        ],
        [
          227.83,
          220.0
        ],
        [
          229.34,
          208.96
        ],
        [
          235.72,
          199.72
        ],
        [
          245.75,
          195.25
        ],
        [
          256.0,
          193.24
        ],
        [
          267.5,
          192.23
        ],
        [
          275.03,
          200.97
        ],
        [
          283.55,
          208.59
        ]
      ],
      "closed": true,
      "color": "#E9C46A",
      "pressure": null
    },
    {
      "id": "stem",
      "points": [
        [
          254.22,
          249.25
        ],
        [
          250.7,
          378.92
        ]
      ],
      "closed": false,
      "color": "#2A9D8F",
      "pressure": null
    }
  ],
  "seed": 1,
  "meta": {
    "description": "flower with stem",
    "category": "flower"
  }
}