{
  "canvas": {
    "width": 512,
    "height": 512
  },
  "strokes": [
    {
      "id": "arc",
      "points": [
        [
          120,
          303.47
        ],
        [
          132,
          287.72
        ],
        [
          144,
          280.03
        ],
        [
          156,
          264.75
        ],
        [
          168,
          256.61
        ],
        [
          180,
          245.8
        ],
        [
          192,
          239.88
        ],
        [
          204,
          229.3
        ],
        [
          216,
          226.56
        ],
        [
          228,
          221.77
        ],
        [
          240,
          217.13
        ],
        [
          252,
          222.52
        ],
        [
          264,
          224.11
        ],
        [
          276,
          220.44
        ],
        [
          288,
          228.29
        ],
        [
          300,
          232.93
        ],
        [
          312,
          238.94
        ],
        [
          324,
          248.33
        ],
        [
          336,
          258.04
        ],
        [
          348,
          264.99
        ],
        [
          360,
          276.36
        ],
        [
          372,
          288.67
        ],
        [
          384,
          303.95
        ],
        [
          396,
          314.83
        ]
      ],
      "closed": false,
      "color": "#9B5DE5",
      "pressure": null
    }
  ],
  "seed": 1,
  "meta": {
    "description": "open arc stroke",
    "category": "open_stroke"
  }
}