{
  "canvas": {
    "width": 512,
    "height": 512
  },
  "strokes": [
    {
      "id": "body",
      "points": [
        [
          342.35,
          280.0
        ],
        [
          345.18,
          292.64
        ],
        [
          344.43,
          306.25
        ],
        [
          330.65,
          316.16
        ],
        [
          316.05,
          324.46
        ],
        [
          299.62,
          330.37
        ],
        [
          282.2,
          333.76
        ],
        [
          266.16,
          344.43
        ],
        [
          246.21,
          342.1
        ],
        [
          229.3,
          334.78
        ],
        [
          210.32,
          332.75
        ],
        [
          193.77,
          326.08
        ],
        [
          178.45,
          317.56
        ],
        [
          176.67,
          303.55
        ],
        [
          170.59,
          292.1
        ],
        [
          170.5,
          280.0
        ],
        [
          166.7,
          267.35
        ],
        [
          168.23,
          253.95
        ],
        [
          180.46,
          243.41
        ],
        [
          199.25,
          237.98
        ],
        [
          211.92,
          229.1
        ],
        [
          230.07,
          226.8
        ],
        [
          247.1,
          223.57
        ],
        [
          265.4,
          220.4
        ],
        [
          282.27,
          226.1
        ],
        [
          299.35,
          229.95
        ],
        [
          313.75,
          237.24
        ],
        [
          327.91,
          245.17
        ],
        [
          342.9,
          254.21
        ],
        [
          340.31,
          268.05
        ]
      ],
      "closed": true,
      "color": "#F4A261",
      "pressure": null
    },
    {
      "id": "head",
      "points": [
        [
          311.99,
          190.0
        ],
        [
          308.28,
          202.73
        ],
        [
          302.04,
          214.17
        ],
        [
          293.64,
          224.22
        ],
        [
          284.73,
          235.23
        ],
        [
          271.02,
          240.94
        ],
        [
          256.0,
          241.86
        ],
        [
          240.88,
          241.3
        ],
        [
          227.5,
          234.88
        ],
        [
          218.36,
          224.22
        ],
        [
          210.4,
          213.94
        ],
        [
          202.31,
          203.08
        ],
        [
          200.04,
          190.0
        ],
        [
          200.45,
          176.47
        ],
        [
          205.27,
          163.38
        ],
        [
          215.26,
          152.96
        ],
        [
          226.41,
          143.4
        ],
        [
          241.37,
          140.36
        ],
        [
          256.0,
          138.54
        ],
        [
          270.92,
          139.39
        ],
        [
          283.49,
          146.72
        ],
        [
          296.75,
          152.96
        ],
        [
          306.49,
          163.5
        ],
        [
          309.23,
          177.03
        ]
      ],
      "closed": true,
      "color": "#F4A261",
      "pressure": null
    },
    {
      "id": "ear_l",
      "points": [
        [
          219.37,
          159.52
        ],
        [
          200.45,
          110.26
        ],
        [
          244.98,
          149.56
        ]
      ],
      "closed": true,
      "color": "#F4A261",
      "pressure": null
    },
    {
      "id": "ear_r",
      "points": [
        [
          290.95,
          160.74
        ],
        [
          321.75,
          116.85
        ],
        [
          268.05,
          149.6
        ]
      ],
      "closed": true,
      "color": "#F4A261",
      "pressure": null
    },
    {
      "id": "tail",
      "points": [
        [
          341.46,
          280.22
        ],
        [
          380.71,
          238.54
        ],
        [
          399.31,
          202.17
        ],
        [
          371.02,
          182.27
        ]
      ],
      "closed": false,
      "color": "#F4A261",
      "pressure": null
    }
  ],
  "seed": 1,
  "meta": {
    "description": "cat-like animal",
    "category": "animal"
  }
}