{
  "canvas": {
    "width": 512,
    "height": 512
  },
  "strokes": [
    {
      "id": "five",
      "points": [
        [
          301.93,
          160.6
        ],
        [
          201.33,
          157.05
        ],
        [
          200.88,
          251.43
        ],
        [
          279.88,
          249.9
        ],
        [
          298.48,
          299.45
        ],
        [
          280.5,
          362.19
        ],
        [
          200.44,
          359.71
        ]
      ],
      "closed": false,
      "color": "#222222",
      "pressure": null
    }
  ],
  "seed": 1,
  "meta": {
    "description": "number 5",
    "category": "number"
  }
}