{
  "canvas": {
    "width": 512,
    "height": 512
  },
  "strokes": [
    {
      "id": "arc",
      "points": [
        [
          120,
          283.47
        ],
        [
          132,
          267.72
        ],
        [
          144,
          260.03
        ],
        [
          156,
          244.75
        ],
        [
          168,
          236.61
        ],
        [
          180,
          225.8
        ],
        [
          192,
          219.88
        ],
        [
          204,
          209.3
        ],
        [
          216,
          206.56
        ],
        [
          228,
          201.77
        ],
        [
          240,
          197.13
        ],
        [
          252,
          202.52
        ],
        [
          264,
          204.11
        ],
        [
          276,
          200.44
        ],
        [
          288,
          208.29
        ],
        [
          300,
          212.93
        ],
        [
          312,
          218.94
        ],
        [
          324,
          228.33
        ],
        [
          336,
          238.04
        ],
        [
          348,
          244.99
        ],
        [
          360,
          256.36
        ],
        [
          372,
          268.67
        ],
        [
          384,
          283.95
        ]
      ],
      "closed": false,
      "color": "#7E57C2",
      "pressure": null
    }
  ],
  "seed": 110,
  "meta": {
    "description": "open swoosh stroke",
    "category": "open_stroke",
    "corpus": "golden"
  }
}