{
  "canvas": {
    "width": 512,
    "height": 512
  },
  "strokes": [
    {
      "id": "s1",
      "points": [
        [
          254.93,
          127.52
        ],
        [
          285.19,
          213.55
        ],
        [
          347.59,
          211.43
        ],
        [
          299.98,
          260.7
        ],
        [
          310.62,
          339.02
        ],
        [
          259.7,
          298.44
        ],
        [
          204.31,
          330.14
        ],
        [
          211.92,
          269.12
        ],
        [
          159.06,
          226.73
        ],
        [
          232.98,
          218.01
        ]
      ],
      "closed": true,
      "color": "#FFD166",
      "pressure": null
    }
  ],
  "seed": 103,
  "meta": {
    "description": "wonky 5-point star",
    "category": "star",
    "corpus": "golden"
  }
}