{
  "canvas": {
    "width": 512,
    "height": 512
  },
  "strokes": [
    {
      "id": "s1",
      "points": [
        [
          368.68,
          260.0
        ],
        [
          354.7,
          272.79
        ],
        [
          375.22,
          291.69
        ],
        [
          366.48,
          306.06
        ],
        [
          344.11,
          312.38
        ],
        [
          337.6,
          326.76
        ],
        [
          315.12,
          326.58
        ],
        [
          301.77,
          333.5
        ],
        [
          287.84,
          340.16
        ],
        [
          274.2,
          354.02
        ],
        [
          256.0,
          342.23
        ],
        [
          236.36,
          361.46
        ],
        [
          226.39,
          334.56
        ],
        [
          210.66,
          332.81
        ],
        [
          199.32,
          323.83
        ],
        [
          171.92,
          328.79
        ],
        [
          170.57,
          310.78
        ],
        [
          158.82,
          300.51
        ],
        [
          156.84,
          286.36
        ],
        [
          142.88,
          274.66
        ],
        [
          149.17,
          260.0
        ],
        [
          156.86,
          247.15
        ],
        [
          153.58,
          232.77
        ],
        [
          163.74,
          221.54
        ],
        [
          177.4,
          213.28
        ],
        [
          170.67,
          190.19
        ],
        [
          187.85,
          183.25
        ],
        [
          203.59,
          175.85
        ],
        [
          218.11,
          164.58
        ],
        [
          239.34,
          173.92
        ],
        [
          256.0,
          173.26
        ],
        [
          272.81,
          173.16
        ],
        [
          289.02,
          176.86
        ],
        [
          308.47,
          175.75
        ],
        [
          311.08,
          197.97
        ],
        [
          332.94,
          197.05
        ],
        [
          345.93,
          206.54
        ],
        [
          349.47,
          221.03
        ],
        [
          345.61,
          236.18
        ],
        [
          371.31,
          245.06
        ]
      ],
      "closed": true,
      "color": "#FF8A5B",
      "pressure": null
    }
  ],
  "seed": 1,
  "meta": {
    "description": "closed organic blob",
    "category": "closed_blob"
  }
}