{
  "canvas": {
    "width": 512,
    "height": 512
  },
  "strokes": [
    {
      "id": "body",
      "points": [
        [
          231.26,
          362.41
        ],
        [
          232.1,
          202.65
        ],
        [
          257.93,
          147.34
        ],
        [
          278.84,
          201.83
        ],
        [
          280.13,
          362.83
        ],
        [
          231.26,
          362.41
        ]
      ],
      "closed": true,
      "color": "#90CAF9",
      "pressure": null
    },
    {
      "id": "fin_l",
      "points": [
        [
          229.46,
          319.8
        ],
        [
          190.62,
          370.76
        ],
        [
          230.99,
          349.11
        ]
      ],
      "closed": true,
      "color": "#EF5350",
      "pressure": null
    },
    {
      "id": "fin_r",
      "points": [
        [
          281.94,
          318.55
        ],
        [
          321.1,
          369.96
        ],
        [
          280.3,
          349.4
        ]
      ],
      "closed": true,
      "color": "#EF5350",
      "pressure": null
    },
    {
      "id": "window",
      "points": [
        [
          274.57,
          230.0
        ],
        [
          272.1,
          237.41
        ],
        [
          268.64,
          244.05
        ],
        [
          262.57,
          247.62
        ],
        [
          256.0,
          250.48
        ],
        [
          249.39,
          247.74
        ],
        [
          243.68,
          243.69
        ],
        [
          238.96,
          237.84
        ],
        [
          238.1,
          230.0
        ],
        [
          239.28,
          222.31
        ],
        [
          243.13,
          215.7
        ],
        [
          249.11,
          211.53
        ],
        [
          256.0,
          210.15
        ],
        [
          262.65,
          212.16
        ],
        [
          268.27,
          216.36
        ],
        [
          272.14,
          222.57
        ]
      ],
      "closed": true,
      "color": "#BBDEFB",
      "pressure": null
    }
  ],
  "seed": 106,
  "meta": {
    "description": "simple rocket with fins and window",
    "category": "rocket",
    "corpus": "golden"
  }
}