{
  "canvas": {
    "width": 512,
    "height": 512
  },
  "strokes": [
    {
      "id": "head",
      "points": [
        [
          356.24,
          240.0
        ],
        [
          354.39,
          253.64
        ],
        [
          350.32,
          266.6
        ],
        [
          340.9,
          277.02
        ],
        [
          336.6,
          288.98
        ],
        [
          333.3,
          302.44
        ],
        [
          325.65,
          313.31
        ],
        [
          310.48,
          314.73
        ],
        [
          301.6,
          323.14
        ],
        [
          294.08,
          336.77
        ],
        [
          279.46,
          332.17
        ],
        [
          268.63,
          340.99
        ],
        [
          256.0,
          337.96
        ],
        [
          243.38,
          340.88
        ],
        [
          230.34,
          340.79
        ],
        [
          219.29,
          333.29
        ],
        [
          209.12,
          325.47
        ],
        [
          199.4,
          317.64
        ],
        [
          187.85,
          311.74
        ],
        [
          179.47,
          301.81
        ],
        [
          174.62,
          289.46
        ],
        [
          168.59,
          278.11
        ],
        [
          163.84,
          265.99
        ],
        [
          164.54,
          252.67
        ],
        [
          164.65,
          240.0
        ],
        [
          161.04,
          226.84
        ],
        [
          168.64,
          215.36
        ],
        [
          167.2,
          201.28
        ],
        [
          170.75,
          188.19
        ],
        [
          177.66,
          176.73
        ],
        [
          190.82,
          171.39
        ],
        [
          198.76,
          161.48
        ],
        [
          206.09,
          149.0
        ],
        [
          220.3,
          149.28
        ],
        [
          229.96,
          137.71
        ],
        [
          244.05,
          144.43
        ],
        [
          256.0,
          135.91
        ],
        [
          267.72,
          146.32
        ],
        [
          281.08,
          141.47
        ],
        [
          293.69,
          144.22
        ],
        [
          303.77,
          152.9
        ],
        [
          314.75,
          159.4
        ],
        [
          326.51,
          165.78
        ],
        [
          335.86,
          175.5
        ],
        [
          335.11,
          191.92
        ],
        [
          344.01,
          201.63
        ],
        [
          342.7,
          215.55
        ],
        [
          348.81,
          227.14
        ]
      ],
      "closed": true,
      "color": "#FFE08A",
      "pressure": null
    },
    {
      "id": "eye_l",
      "points": [
        [
          229.65,
          220.0
        ],
        [
          228.37,
          225.8
        ],
        [
          225.06,
          230.52
        ],
        [
          220.0,
          231.5
        ],
        [
          215.17,
          230.03
        ],
        [
          211.76,
          225.71
        ],
        [
          209.69,
          220.0
        ],
        [
          211.56,
          214.15
        ],
        [
          215.21,
          210.05
        ],
        [
          220.0,
          207.85
        ],
        [
          225.11,
          209.38
        ],
        [
          228.77,
          213.92
        ]
      ],
      "closed": true,
      "color": "#333333",
      "pressure": null
    },
    {
      "id": "eye_r",
      "points": [
        [
          303.05,
          218.0
        ],
        [
          301.56,
          224.02
        ],
        [
          297.62,
          228.62
        ],
        [
          292.0,
          229.77
        ],
        [
          286.31,
          228.75
        ],
        [
          282.29,
          224.12
        ],
        [
          280.61,
          218.0
        ],
        [
          282.1,
          211.77
        ],
        [
          286.31,
          207.25
        ],
        [
          292.0,
          205.98
        ],
        [
          297.51,
          207.58
        ],
        [
          301.75,
          211.86
        ]
      ],
      "closed": true,
      "color": "#333333",
      "pressure": null
    },
    {
      "id": "smile",
      "points": [
        [
          210.32,
          278.11
        ],
        [
          219.67,
          283.46
        ],
        [
          225.94,
          288.81
        ],
        [
          232.37,
          293.04
        ],
        [
          242.36,
          296.84
        ],
        [
          250.45,
          296.61
        ],
        [
          258.26,
          299.84
        ],
        [
          266.55,
          298.76
        ],
        [
          272.05,
          296.35
        ],
        [
          280.84,
          291.38
        ],
        [
          289.32,
          287.71
        ],
        [
          296.34,
          283.5
        ],
        [
          304.92,
          279.0
        ]
      ],
      "closed": false,
      "color": "#333333",
      "pressure": null
    }
  ],
  "seed": 104,
  "meta": {
    "description": "simple face with smile",
    "category": "face",
    "corpus": "golden"
  }
}