{
  "canvas": {
    "width": 512,
    "height": 512
  },
  "strokes": [
    {
      "id": "body",
      "points": [
        [
          332.75,
          300.0
        ],
        [
          335.81,
          312.31
        ],
        [
          336.86,
          325.75
        ],
        [
          327.03,
          335.88
        ],
        [
          317.11,
          344.87
        ],
        [
          305.85,
          351.98
        ],
        [
          293.68,
          357.11
        ],
        [
          285.55,
          371.03
        ],
        [
          270.46,
          371.74
        ],
        [
          256.0,
          367.2
        ],
        [
          241.9,
          369.98
        ],
        [
          227.72,
          367.98
        ],
        [
          213.4,
          364.57
        ],
        [
          206.38,
          351.74
        ],
        [
          196.55,
          343.65
        ],
        [
          190.18,
          333.25
        ],
        [
          179.74,
          324.29
        ],
        [
          171.9,
          312.98
        ],
        [
          173.0,
          300.0
        ],
        [
          181.76,
          288.55
        ],
        [
          182.36,
          276.55
        ],
        [
          191.41,
          267.37
        ],
        [
          198.04,
          257.45
        ],
        [
          204.63,
          246.44
        ],
        [
          218.22,
          242.74
        ],
        [
          229.64,
          236.64
        ],
        [
          242.68,
          233.9
        ],
        [
          256.0,
          230.87
        ],
        [
          270.68,
          227.14
        ],
        [
          282.2,
          237.01
        ],
        [
          296.72,
          238.28
        ],
        [
          306.6,
          247.23
        ],
        [
          315.24,
          256.51
        ],
        [
          323.05,
          266.13
        ],
        [
          334.53,
          274.99
        ],
        [
          339.1,
          287.18
        ]
      ],
      "closed": true,
      "color": "#D7A86E",
      "pressure": null
    },
    {
      "id": "head",
      "points": [
        [
          312.79,
          200.0
        ],
        [
          312.88,
          210.29
        ],
        [
          308.44,
          219.75
        ],
        [
          300.44,
          227.0
        ],
        [
          293.44,
          234.04
        ],
        [
          286.84,
          241.96
        ],
        [
          277.37,
          246.9
        ],
        [
          267.16,
          250.99
        ],
        [
          256.0,
          252.84
        ],
        [
          244.82,
          251.08
        ],
        [
          233.55,
          249.27
        ],
        [
          224.7,
          242.59
        ],
        [
          216.12,
          236.26
        ],
        [
          208.35,
          228.94
        ],
        [
          205.21,
          219.13
        ],
        [
          199.81,
          210.16
        ],
        [
          198.11,
          200.0
        ],
        [
          201.96,
          190.23
        ],
        [
          206.3,
          181.29
        ],
        [
          211.03,
          172.68
        ],
        [
          216.5,
          164.09
        ],
        [
          225.16,
          158.04
        ],
        [
          234.97,
          153.84
        ],
        [
          245.44,
          151.72
        ],
        [
          256.0,
          148.33
        ],
        [
          267.01,
          149.69
        ],
        [
          278.33,
          150.98
        ],
        [
          288.53,
          155.74
        ],
        [
          292.24,
          167.05
        ],
        [
          301.09,
          172.61
        ],
        [
          308.54,
          180.21
        ],
        [
          310.22,
          190.2
        ]
      ],
      "closed": true,
      "color": "#D7A86E",
      "pressure": null
    },
    {
      "id": "ear_l",
      "points": [
        [
          232.52,
          160.0
        ],
        [
          229.34,
          167.28
        ],
        [
          225.2,
          173.82
        ],
        [
          219.03,
          179.81
        ],
        [
          210.0,
          180.68
        ],
        [
          200.94,
          179.88
        ],
        [
          193.14,
          175.32
        ],
        [
          187.96,
          168.3
        ],
        [
          186.39,
          160.0
        ],
        [
          187.98,
          151.71
        ],
        [
          193.21,
          144.73
        ],
        [
          200.86,
          139.93
        ],
        [
          210.0,
          140.34
        ],
        [
          218.26,
          141.86
        ],
        [
          225.39,
          146.01
        ],
        [
          231.41,
          151.94
        ]
      ],
      "closed": true,
      "color": "#C48A4A",
      "pressure": null
    },
    {
      "id": "ear_r",
      "points": [
        [
          326.1,
          158.0
        ],
        [
          323.02,
          165.92
        ],
        [
          317.34,
          171.94
        ],
        [
          309.71,
          174.93
        ],
        [
          302.0,
          176.53
        ],
        [
          294.31,
          174.88
        ],
        [
          287.53,
          171.15
        ],
        [
          283.71,
          164.89
        ],
        [
          280.45,
          158.0
        ],
        [
          282.47,
          150.65
        ],
        [
          285.05,
          142.59
        ],
        [
          294.16,
          140.8
        ],
        [
          302.0,
          139.63
        ],
        [
          311.09,
          138.05
        ],
        [
          318.87,
          142.66
        ],
        [
          322.37,
          150.33
        ]
      ],
      "closed": true,
      "color": "#C48A4A",
      "pressure": null
    },
    {
      "id": "eye_l",
      "points": [
        [
          245.05,
          195.0
        ],
        [
          243.48,
          199.55
        ],
        [
          240.12,
          202.45
        ],
        [
          235.93,
          202.28
        ],
        [
          232.79,
          199.33
        ],
        [
          230.33,
          195.0
        ],
        [
          231.92,
          189.95
        ],
        [
          235.68,
          186.84
        ],
        [
          240.01,
          187.93
        ],
        [
          243.82,
          190.17
        ]
      ],
      "closed": true,
      "color": "#333333",
      "pressure": null
    },
    {
      "id": "eye_r",
      "points": [
        [
          280.38,
          195.0
        ],
        [
          279.91,
          199.9
        ],
        [
          275.98,
          201.95
        ],
        [
          271.79,
          202.77
        ],
        [
          268.72,
          199.38
        ],
        [
          266.33,
          195.0
        ],
        [
          267.87,
          189.91
        ],
        [
          271.87,
          187.51
        ],
        [
          276.34,
          186.75
        ],
        [
          279.98,
          190.03
        ]
      ],
      "closed": true,
      "color": "#333333",
      "pressure": null
    }
  ],
  "seed": 107,
  "meta": {
    "description": "teddy-like round bear",
    "category": "teddy",
    "corpus": "golden"
  }
}