{
  "canvas": {
    "width": 512,
    "height": 512
  },
  "strokes": [
    {
      "id": "bloom",
      "points": [
        [
          321.37,
          230.0
        ],
        [
          332.55,
          242.53
        ],
        [
          317.94,
          250.93
        ],
        [
          322.54,
          265.67
        ],
        [
          303.89,
          267.32
        ],
        [
          298.98,
          277.56
        ],
        [
          292.46,
          288.64
        ],
        [
          278.39,
          287.12
        ],
        [
          269.6,
          301.65
        ],
        [
          256.0,
          296.98
        ],
        [
          242.74,
          299.84
        ],
        [
          231.08,
          293.57
        ],
        [
          218.02,
          291.09
        ],
        [
          214.96,
          275.42
        ],
        [
          204.15,
          270.4
        ],
        [
          199.09,
          260.51
        ],
        [
          192.1,
          251.6
        ],
        [
          193.34,
          240.26
        ],
        [
          192.09,
          230.0
        ],
        [
          186.91,
          218.69
        ],
        [
          183.12,
          205.37
        ],
        [
          193.3,
          196.38
        ],
        [
          200.51,
          186.76
        ],
        [
          206.58,
          175.31
        ],
        [
          220.33,
          172.63
        ],
        [
          231.66,
          167.89
        ],
        [
          243.56,
          164.47
        ],
        [
          256.0,
          164.58
        ],
        [
          267.17,
          171.17
        ],
        [
          277.62,
          174.85
        ],
        [
          293.96,
          168.95
        ],
        [
          300.66,
          180.57
        ],
        [
          313.45,
          185.24
        ],
        [
          310.1,
          201.0
        ],
        [
          321.78,
          207.77
        ],
        [
          331.83,
          217.58
        ]
      ],
      "closed": true,
      "color": "#E53935",
      "pressure": null
    },
    {
      "id": "spiral",
      "points": [
        [
          266.9,
          229.8
        ],
        [
          270.05,
          230.11
        ],
        [
          271.14,
          237.02
        ],
        [
          272.11,
          237.91
        ],
        [
          273.16,
          240.96
        ],
        [
          269.63,
          246.44
        ],
        [
          267.23,
          250.23
        ],
        [
          268.02,
          251.87
        ],
        [
          262.5,
          252.44
        ],
        [
          256.26,
          258.39
        ],
        [
          253.79,
          259.35
        ],
        [
          245.01,
          260.69
        ],
        [
          243.06,
          261.28
        ],
        [
          235.06,
          257.91
        ],
        [
          227.53,
          254.08
        ],
        [
          219.6,
          254.64
        ],
        [
          215.92,
          247.12
        ],
        [
          211.71,
          244.43
        ],
        [
          210.26,
          236.39
        ],
        [
          207.26,
          228.24
        ],
        [
          205.67,
          221.71
        ],
        [
          206.41,
          209.78
        ],
        [
          207.73,
          204.21
        ],
        [
          212.77,
          197.91
        ],
        [
          219.01,
          187.81
        ],
        [
          224.76,
          182.87
        ],
        [
          234.88,
          175.08
        ],
        [
          243.06,
          171.96
        ],
        [
          254.54,
          169.39
        ],
        [
          268.04,
          166.99
        ],
        [
          278.74,
          166.6
        ],
        [
          292.0,
          171.71
        ],
        [
          302.68,
          174.47
        ],
        [
          311.06,
          180.48
        ],
        [
          321.75,
          191.32
        ],
        [
          331.63,
          201.62
        ],
        [
          339.88,
          209.96
        ],
        [
          340.36,
          224.62
        ],
        [
          343.73,
          238.32
        ],
        [
          343.31,
          248.88
        ],
        [
          342.65,
          265.06
        ],
        [
          336.15,
          278.06
        ],
        [
          328.56,
          291.3
        ],
        [
          313.37,
          298.47
        ],
        [
          300.25,
          311.35
        ],
        [
          287.66,
          318.77
        ],
        [
          269.25,
          321.41
        ],
        [
          255.68,
          326.44
        ],
        [
          233.94,
          324.03
        ],
        [
          218.98,
          324.93
        ],
        [
          197.8,
          320.11
        ],
        [
          181.1,
          308.88
        ],
        [
          168.39,
          300.1
        ],
        [
          156.47,
          282.88
        ],
        [
          142.66,
          268.14
        ],
        [
          133.98,
          253.79
        ],
        [
          129.73,
          234.29
        ],
        [
          131.29,
          217.11
        ],
        [
          133.07,
          197.5
        ],
        [
          139.75,
          176.38
        ]
      ],
      "closed": false,
      "color": "#C62828",
      "pressure": null
    },
    {
      "id": "leaf",
      "points": [
        [
          356.1,
          300.0
        ],
        [
          361.12,
          306.73
        ],
        [
          349.73,
          311.22
        ],
        [
          340.06,
          315.64
        ],
        [
          327.12,
          318.18
        ],
        [
          312.93,
          318.05
        ],
        [
          300.72,
          315.03
        ],
        [
          286.68,
          312.58
        ],
        [
          283.94,
          305.91
        ],
        [
          283.97,
          300.0
        ],
        [
          286.05,
          294.44
        ],
        [
          286.45,
          287.33
        ],
        [
          301.04,
          285.22
        ],
        [
          313.27,
          282.83
        ],
        [
          327.07,
          281.96
        ],
        [
          340.06,
          284.36
        ],
        [
          349.7,
          288.78
        ],
        [
          359.25,
          293.57
        ]
      ],
      "closed": true,
      "color": "#43A047",
      "pressure": null
    },
    {
      "id": "stem",
      "points": [
        [
          256.31,
          293.43
        ],
        [
          260.81,
          360.8
        ],
        [
          255.97,
          400.82
        ]
      ],
      "closed": false,
      "color": "#2E7D32",
      "pressure": null
    }
  ],
  "seed": 109,
  "meta": {
    "description": "rose-like bloom with spiral cue and leaf",
    "category": "rose",
    "corpus": "golden"
  }
}