{
  "canvas": {
    "width": 512,
    "height": 512
  },
  "strokes": [
    {
      "id": "center",
      "points": [
        [
          281.93,
          200.0
        ],
        [
          284.31,
          209.2
        ],
        [
          280.38,
          217.71
        ],
        [
          272.08,
          222.13
        ],
        [
          264.27,
          225.44
        ],
        [
          256.0,
          226.3
        ],
        [
          248.07,
          224.4
        ],
        [
          240.48,
          221.36
        ],
        [
          234.7,
          215.48
        ],
        [
          227.49,
          209.26
        ],
        [
          229.73,
          200.0
        ],
        [
          231.02,
          191.88
        ],
        [
          231.41,
          182.13
        ],
        [
          238.17,
          175.46
        ],
        [
          248.04,
          175.49
        ],
        [
          256.0,
          172.99
        ],
        [
          265.5,
          170.77
        ],
        [
          272.1,
          177.84
        ],
        [
          279.23,
          183.12
        ],
        [
          283.65,
          191.02
        ]
      ],
      "closed": true,
      "color": "#FFEB3B",
      "pressure": null
    },
    {
      "id": "petal_0",
      "points": [
        [
          339.82,
          200.0
        ],
        [
          334.57,
          206.28
        ],
        [
          331.68,
          213.3
        ],
        [
          322.39,
          217.67
        ],
        [
          311.0,
          217.81
        ],
        [
          300.62,
          216.12
        ],
        [
          290.32,
          213.29
        ],
        [
          282.6,
          207.56
        ],
        [
          280.52,
          200.0
        ],
        [
          286.68,
          193.52
        ],
        [
          290.18,
          186.61
        ],
        [
          300.31,
          183.4
        ],
        [
          311.0,
          180.25
        ],
        [
          322.72,
          181.81
        ],
        [
          330.74,
          187.31
        ],
        [
          338.95,
          192.56
        ]
      ],
      "closed": true,
      "color": "#F48FB1",
      "pressure": null
    },
    {
      "id": "petal_1",
      "points": [
        [
          313.65,
          247.63
        ],
        [
          307.36,
          253.98
        ],
        [
          302.93,
          260.12
        ],
        [
          295.17,
          265.75
        ],
        [
          283.5,
          264.68
        ],
        [
          272.92,
          264.06
        ],
        [
          263.19,
          260.69
        ],
        [
          258.39,
          254.32
        ],
        [
          253.9,
          247.63
        ],
        [
          259.27,
          241.18
        ],
        [
          263.31,
          234.65
        ],
        [
          272.67,
          230.83
        ],
        [
          283.5,
          231.33
        ],
        [
          294.84,
          230.03
        ],
        [
          304.45,
          234.16
        ],
        [
          311.19,
          240.26
        ]
      ],
      "closed": true,
      "color": "#F48FB1",
      "pressure": null
    },
    {
      "id": "petal_2",
      "points": [
        [
          254.77,
          247.63
        ],
        [
          254.53,
          254.56
        ],
        [
          246.92,
          259.47
        ],
        [
          239.72,
          265.04
        ],
        [
          228.5,
          266.04
        ],
        [
          216.95,
          265.56
        ],
        [
          210.14,
          259.43
        ],
        [
          203.91,
          254.18
        ],
        [
          202.9,
          247.63
        ],
        [
          200.42,
          240.16
        ],
        [
          208.13,
          234.53
        ],
        [
          218.55,
          232.2
        ],
        [
          228.5,
          228.77
        ],
        [
          239.1,
          231.18
        ],
        [
          247.91,
          235.15
        ],
        [
          255.83,
          240.35
        ]
      ],
      "closed": true,
      "color": "#F48FB1",
      "pressure": null
    },
    {
      "id": "petal_3",
      "points": [
        [
          230.3,
          200.0
        ],
        [
          226.79,
          206.87
        ],
        [
          219.98,
          212.2
        ],
        [
          211.47,
          216.26
        ],
        [
          201.0,
          217.6
        ],
        [
          190.96,
          215.58
        ],
        [
          182.5,
          211.89
        ],
        [
          174.82,
          206.97
        ],
        [
          170.36,
          200.0
        ],
        [
          174.7,
          193.0
        ],
        [
          181.58,
          187.52
        ],
        [
          191.29,
          184.93
        ],
        [
          201.0,
          180.49
        ],
        [
          211.32,
          183.98
        ],
        [
          219.99,
          187.79
        ],
        [
          228.0,
          192.81
        ]
      ],
      "closed": true,
      "color": "#F48FB1",
      "pressure": null
    },
    {
      "id": "petal_4",
      "points": [
        [
          258.64,
          152.37
        ],
        [
          252.35,
          158.72
        ],
        [
          246.6,
          164.0
        ],
        [
          238.61,
          168.05
        ],
        [
          228.5,
          172.15
        ],
        [
          217.76,
          169.04
        ],
        [
          210.28,
          164.08
        ],
        [
          201.85,
          159.46
        ],
        [
          200.49,
          152.37
        ],
        [
          204.67,
          146.02
        ],
        [
          210.42,
          140.74
        ],
        [
          218.06,
          136.16
        ],
        [
          228.5,
          132.68
        ],
        [
          239.06,
          135.98
        ],
        [
          250.24,
          138.39
        ],
        [
          253.73,
          145.65
        ]
      ],
      "closed": true,
      "color": "#F48FB1",
      "pressure": null
    },
    {
      "id": "petal_5",
      "points": [
        [
          310.51,
          152.37
        ],
        [
          307.31,
          158.71
        ],
        [
          303.72,
          165.36
        ],
        [
          293.49,
          167.87
        ],
        [
          283.5,
          171.99
        ],
        [
          272.52,
          169.41
        ],
        [
          265.6,
          163.88
        ],
        [
          257.01,
          159.42
        ],
        [
          255.65,
          152.37
        ],
        [
          256.81,
          145.26
        ],
        [
          263.29,
          139.37
        ],
        [
          273.62,
          137.03
        ],
        [
          283.5,
          134.44
        ],
        [
          294.5,
          135.29
        ],
        [
          301.66,
          140.7
        ],
        [
          311.32,
          144.96
        ]
      ],
      "closed": true,
      "color": "#F48FB1",
      "pressure": null
    },
    {
      "id": "stem",
      "points": [
        [
          256.85,
          228.77
        ],
        [
          256.3,
          299.61
        ],
        [
          254.52,
          380.52
        ]
      ],
      "closed": false,
      "color": "#66BB6A",
      "pressure": null
    }
  ],
  "seed": 108,
  "meta": {
    "description": "six-petal flower with stem",
    "category": "flower",
    "corpus": "golden"
  }
}