{
  "canvas": {
    "width": 512,
    "height": 512
  },
  "strokes": [
    {
      "id": "a",
      "points": [
        [
          207.94,
          220.0
        ],
        [
          200.97,
          229.76
        ],
        [
          202.42,
          241.77
        ],
        [
          191.78,
          248.25
        ],
        [
          182.04,
          253.93
        ],
        [
          171.92,
          259.54
        ],
        [
          160.0,
          257.36
        ],
        [
          149.07,
          256.27
        ],
        [
          137.85,
          254.1
        ],
        [
          129.9,
          246.76
        ],
        [
          119.7,
          240.68
        ],
        [
          117.26,
          230.18
        ],
        [
          116.05,
          220.0
        ],
        [
          118.47,
          210.11
        ],
        [
          123.21,
          201.12
        ],
        [
          126.8,
          190.49
        ],
        [
          135.69,
          182.57
        ],
        [
          148.7,
          182.52
        ],
        [
          160.0,
          177.57
        ],
        [
          171.21,
          182.81
        ],
        [
          183.67,
          183.55
        ],
        [
          190.16,
          193.19
        ],
        [
          199.51,
          199.73
        ],
        [
          202.66,
          209.84
        ]
      ],
      "closed": true,
      "color": "#FF8A65",
      "pressure": null
    },
    {
      "id": "b",
      "points": [
        [
          353.71,
          200.0
        ],
        [
          350.82,
          209.53
        ],
        [
          339.9,
          216.13
        ],
        [
          332.52,
          222.77
        ],
        [
          324.8,
          230.07
        ],
        [
          312.2,
          231.88
        ],
        [
          300.0,
          233.17
        ],
        [
          285.89,
          236.86
        ],
        [
          272.8,
          232.98
        ],
        [
          268.06,
          222.36
        ],
        [
          260.84,
          215.83
        ],
        [
          250.48,
          209.29
        ],
        [
          245.52,
          200.0
        ],
        [
          247.95,
          190.24
        ],
        [
          255.03,
          181.82
        ],
        [
          262.95,
          174.07
        ],
        [
          275.09,
          169.79
        ],
        [
          287.09,
          166.26
        ],
        [
          300.0,
          162.5
        ],
        [
          311.93,
          168.85
        ],
        [
          325.91,
          168.58
        ],
        [
          336.91,
          174.16
        ],
        [
          340.32,
          183.7
        ],
        [
          350.91,
          190.45
        ]
      ],
      "closed": true,
      "color": "#4FC3F7",
      "pressure": null
    },
    {
      "id": "c",
      "points": [
        [
          277.35,
          340.0
        ],
        [
          282.25,
          352.74
        ],
        [
          276.47,
          363.69
        ],
        [
          268.03,
          371.54
        ],
        [
          260.34,
          379.63
        ],
        [
          251.33,
          387.59
        ],
        [
          240.0,
          383.8
        ],
        [
          230.26,
          380.89
        ],
        [
          219.24,
          380.45
        ],
        [
          209.44,
          374.39
        ],
        [
          207.74,
          360.95
        ],
        [
          199.32,
          352.26
        ],
        [
          200.89,
          340.0
        ],
        [
          199.92,
          327.92
        ],
        [
          205.52,
          317.6
        ],
        [
          209.17,
          305.31
        ],
        [
          219.7,
          300.44
        ],
        [
          228.68,
          292.48
        ],
        [
          240.0,
          290.83
        ],
        [
          249.58,
          299.76
        ],
        [
          261.75,
          297.61
        ],
        [
          269.75,
          306.54
        ],
        [
          272.17,
          319.1
        ],
        [
          279.24,
          328.17
        ]
      ],
      "closed": true,
      "color": "#AED581",
      "pressure": null
    }
  ],
  "seed": 111,
  "meta": {
    "description": "three disconnected colored blobs",
    "category": "multi_part",
    "corpus": "golden"
  }
}