{
  "canvas": {
    "width": 512,
    "height": 512
  },
  "strokes": [
    {
      "id": "a",
      "points": [
        [
          303.99,
          250.0
        ],
        [
          313.42,
          262.87
        ],
        [
          307.85,
          274.79
        ],
        [
          293.94,
          282.3
        ],
        [
          291.77,
          295.35
        ],
        [
          279.27,
          301.38
        ],
        [
          272.44,
          314.32
        ],
        [
          258.91,
          319.5
        ],
        [
          243.45,
          316.75
        ],
        [
          230.0,
          321.1
        ],
        [
          216.12,
          318.88
        ],
        [
          203.6,
          313.48
        ],
        [
          190.43,
          309.97
        ],
        [
          179.44,
          302.72
        ],
        [
          169.04,
          294.76
        ],
        [
          155.71,
          287.53
        ],
        [
          152.05,
          274.83
        ],
        [
          157.04,
          261.26
        ],
        [
          151.89,
          250.0
        ],
        [
          145.32,
          236.93
        ],
        [
          151.69,
          225.06
        ],
        [
          159.54,
          214.4
        ],
        [
          167.28,
          203.95
        ],
        [
          177.06,
          194.8
        ],
        [
          192.15,
          192.63
        ],
        [
          203.05,
          185.2
        ],
        [
          216.6,
          183.52
        ],
        [
          230.0,
          183.45
        ],
        [
          244.31,
          178.98
        ],
        [
          255.33,
          189.11
        ],
        [
          267.95,
          192.49
        ],
        [
          283.15,
          194.58
        ],
        [
          295.15,
          202.17
        ],
        [
          297.1,
          216.1
        ],
        [
          309.42,
          224.71
        ],
        [
          312.98,
          237.2
        ]
      ],
      "closed": true,
      "color": "#FF85A1",
      "pressure": null
    },
    {
      "id": "b",
      "points": [
        [
          360.84,
          270.0
        ],
        [
          368.76,
          282.04
        ],
        [
          356.73,
          291.05
        ],
        [
          354.66,
          302.35
        ],
        [
          343.63,
          309.0
        ],
        [
          335.09,
          316.57
        ],
        [
          328.48,
          327.77
        ],
        [
          317.05,
          334.4
        ],
        [
          302.22,
          330.04
        ],
        [
          290.0,
          333.2
        ],
        [
          276.75,
          335.15
        ],
        [
          263.96,
          332.0
        ],
        [
          254.66,
          323.04
        ],
        [
          240.29,
          321.34
        ],
        [
          236.17,
          309.14
        ],
        [
          220.55,
          304.75
        ],
        [
          217.64,
          292.82
        ],
        [
          214.22,
          281.58
        ],
        [
          209.92,
          270.0
        ],
        [
          219.26,
          259.19
        ],
        [
          222.9,
          248.83
        ],
        [
          223.74,
          236.84
        ],
        [
          228.92,
          225.58
        ],
        [
          238.46,
          216.77
        ],
        [
          250.73,
          211.05
        ],
        [
          263.93,
          207.92
        ],
        [
          277.27,
          207.43
        ],
        [
          290.0,
          202.01
        ],
        [
          303.31,
          204.6
        ],
        [
          317.2,
          205.22
        ],
        [
          329.03,
          211.41
        ],
        [
          338.14,
          220.28
        ],
        [
          348.8,
          227.24
        ],
        [
          351.87,
          239.04
        ],
        [
          358.04,
          248.54
        ],
        [
          366.99,
          258.23
        ]
      ],
      "closed": true,
      "color": "#7BDFF2",
      "pressure": null
    }
  ],
  "seed": 1,
  "meta": {
    "description": "overlapping blobs",
    "category": "overlapping"
  }
}