{
  "canvas": {
    "width": 512,
    "height": 512
  },
  "strokes": [
    {
      "id": "pot",
      "points": [
        [
          202.27,
          339.09
        ],
        [
          211.74,
          402.71
        ],
        [
          298.87,
          401.61
        ],
        [
          309.01,
          337.98
        ],
        [
          200.0,
          340.0
        ]
      ],
      "closed": true,
      "color": "#C4A484",
      "pressure": null
    },
    {
      "id": "stem",
      "points": [
        [
          254.8,
          341.91
        ],
        [
          260.1,
          278.64
        ],
        [
          254.44,
          220.56
        ],
        [
          258.3,
          171.58
        ]
      ],
      "closed": false,
      "color": "#4CAF50",
      "pressure": null
    },
    {
      "id": "leaf_l",
      "points": [
        [
          255.18,
          200.0
        ],
        [
          251.63,
          205.29
        ],
        [
          250.75,
          211.49
        ],
        [
          242.63,
          216.02
        ],
        [
          231.09,
          217.55
        ],
        [
          220.0,
          216.62
        ],
        [
          208.49,
          218.23
        ],
        [
          198.34,
          215.33
        ],
        [
          189.53,
          211.38
        ],
        [
          183.54,
          206.09
        ],
        [
          181.67,
          200.0
        ],
        [
          185.14,
          194.17
        ],
        [
          192.29,
          189.65
        ],
        [
          199.3,
          185.34
        ],
        [
          209.17,
          182.86
        ],
        [
          220.0,
          181.06
        ],
        [
          231.09,
          182.45
        ],
        [
          241.91,
          184.49
        ],
        [
          248.4,
          189.39
        ],
        [
          253.89,
          194.34
        ]
      ],
      "closed": true,
      "color": "#66BB6A",
      "pressure": null
    },
    {
      "id": "leaf_r",
      "points": [
        [
          329.97,
          185.0
        ],
        [
          327.21,
          190.23
        ],
        [
          323.12,
          195.22
        ],
        [
          314.56,
          198.46
        ],
        [
          304.15,
          199.07
        ],
        [
          295.0,
          200.74
        ],
        [
          285.53,
          199.58
        ],
        [
          277.08,
          197.33
        ],
        [
          271.04,
          193.7
        ],
        [
          266.94,
          189.56
        ],
        [
          263.12,
          185.0
        ],
        [
          262.84,
          179.78
        ],
        [
          267.21,
          174.9
        ],
        [
          274.43,
          170.85
        ],
        [
          284.95,
          169.53
        ],
        [
          295.0,
          170.55
        ],
        [
          304.28,
          170.72
        ],
        [
          312.14,
          173.2
        ],
        [
          322.79,
          174.9
        ],
        [
          324.34,
          180.23
        ]
      ],
      "closed": true,
      "color": "#43A047",
      "pressure": null
    }
  ],
  "seed": 105,
  "meta": {
    "description": "potted plant with two leaves",
    "category": "plant",
    "corpus": "golden"
  }
}