{
  "canvas": {
    "width": 512,
    "height": 512
  },
  "strokes": [
    {
      "id": "a",
      "points": [
        [
          199.88,
          200.0
        ],
        [
          200.44,
          206.24
        ],
        [
          198.31,
          212.2
        ],
        [
          195.75,
          218.06
        ],
        [
          192.61,
          223.95
        ],
        [
          186.75,
          227.89
        ],
        [
          178.92,
          228.67
        ],
        [
          173.07,
          231.42
        ],
        [
          166.9,
          234.22
        ],
        [
          160.0,
          234.38
        ],
        [
          152.54,
          237.02
        ],
        [
          145.82,
          234.09
        ],
        [
          140.1,
          230.16
        ],
        [
          134.9,
          226.17
        ],
        [
          130.69,
          221.52
        ],
        [
          124.79,
          217.79
        ],
        [
          119.86,
          212.78
        ],
        [
          122.7,
          205.75
        ],
        [
          120.31,
          200.0
        ],
        [
          121.59,
          194.07
        ],
        [
          121.75,
          187.82
        ],
        [
          126.72,
          183.19
        ],
        [
          131.49,
          179.07
        ],
        [
          133.56,
          172.43
        ],
        [
          140.62,
          170.63
        ],
        [
          146.0,
          166.34
        ],
        [
          152.6,
          163.29
        ],
        [
          160.0,
          164.54
        ],
        [
          167.4,
          163.26
        ],
        [
          174.34,
          165.52
        ],
        [
          178.6,
          171.81
        ],
        [
          184.66,
          174.28
        ],
        [
          191.44,
          176.92
        ],
        [
          194.52,
          182.56
        ],
        [
          194.61,
          188.98
        ],
        [
          201.42,
          193.61
        ]
      ],
      "closed": true,
      "color": "#FF6B6B",
      "pressure": null
    },
    {
      "id": "b",
      "points": [
        [
          366.08,
          220.0
        ],
        [
          363.85,
          225.15
        ],
        [
          362.43,
          230.3
        ],
        [
          356.92,
          234.21
        ],
        [
          354.75,
          239.44
        ],
        [
          347.27,
          241.67
        ],
        [
          343.09,
          246.66
        ],
        [
          336.48,
          250.18
        ],
        [
          327.46,
          248.2
        ],
        [
          320.0,
          248.87
        ],
        [
          312.09,
          249.9
        ],
        [
          303.68,
          249.89
        ],
        [
          298.69,
          244.61
        ],
        [
          291.58,
          242.58
        ],
        [
          284.95,
          239.61
        ],
        [
          283.12,
          234.19
        ],
        [
          280.63,
          229.55
        ],
        [
          273.93,
          225.42
        ],
        [
          274.12,
          220.0
        ],
        [
          275.11,
          214.72
        ],
        [
          277.4,
          209.66
        ],
        [
          283.51,
          205.95
        ],
        [
          285.64,
          200.78
        ],
        [
          291.13,
          197.07
        ],
        [
          297.45,
          193.96
        ],
        [
          305.44,
          193.33
        ],
        [
          312.73,
          192.5
        ],
        [
          320.0,
          189.92
        ],
        [
          328.06,
          189.53
        ],
        [
          335.8,
          191.05
        ],
        [
          344.07,
          192.2
        ],
        [
          348.33,
          197.49
        ],
        [
          353.87,
          201.05
        ],
        [
          357.91,
          205.41
        ],
        [
          362.32,
          209.73
        ],
        [
          365.52,
          214.65
        ]
      ],
      "closed": true,
      "color": "#4ECDC4",
      "pressure": null
    },
    {
      "id": "c",
      "points": [
        [
          292.91,
          340.0
        ],
        [
          286.03,
          344.06
        ],
        [
          287.55,
          348.65
        ],
        [
          285.15,
          353.03
        ],
        [
          279.83,
          356.71
        ],
        [
          271.78,
          358.94
        ],
        [
          263.29,
          360.17
        ],
        [
          256.62,
          362.83
        ],
        [
          248.82,
          365.0
        ],
        [
          240.0,
          366.11
        ],
        [
          231.71,
          363.51
        ],
        [
          223.38,
          362.84
        ],
        [
          215.53,
          361.19
        ],
        [
          210.16,
          357.78
        ],
        [
          198.8,
          357.28
        ],
        [
          197.72,
          352.2
        ],
        [
          193.46,
          348.47
        ],
        [
          187.06,
          344.67
        ],
        [
          187.75,
          340.0
        ],
        [
          192.53,
          335.82
        ],
        [
          189.7,
          330.85
        ],
        [
          194.44,
          326.85
        ],
        [
          201.3,
          323.76
        ],
        [
          208.16,
          321.03
        ],
        [
          213.6,
          317.14
        ],
        [
          221.75,
          314.92
        ],
        [
          231.08,
          314.71
        ],
        [
          240.0,
          315.72
        ],
        [
          249.2,
          313.91
        ],
        [
          257.54,
          315.91
        ],
        [
          266.72,
          316.86
        ],
        [
          273.76,
          319.88
        ],
        [
          279.48,
          323.44
        ],
        [
          286.04,
          326.71
        ],
        [
          286.54,
          331.53
        ],
        [
          290.08,
          335.58
        ]
      ],
      "closed": true,
      "color": "#FFE66D",
      "pressure": null
    }
  ],
  "seed": 1,
  "meta": {
    "description": "three disconnected blobs",
    "category": "multiple_disconnected"
  }
}