{
  "canvas": {
    "width": 512,
    "height": 512
  },
  "strokes": [
    {
      "id": "s1",
      "points": [
        [
          243.24,
          226.17
        ],
        [
          243.44,
          225.5
        ],
        [
          252.74,
          220.53
        ],
        [
          254.39,
          216.32
        ],
        [
          254.49,
          209.8
        ],
        [
          261.96,
          202.9
        ],
        [
          269.54,
          197.39
        ],
        [
          274.92,
          189.28
        ],
        [
          282.92,
          188.28
        ],
        [
          295.92,
          185.49
        ],
        [
          305.31,
          185.57
        ],
        [
          314.67,
          188.8
        ],
        [
          323.95,
          194.68
        ],
        [
          334.63,
          202.36
        ],
        [
          339.03,
          208.49
        ],
        [
          343.43,
          221.62
        ],
        [
          345.67,
          232.71
        ],
        [
          343.92,
          241.99
        ],
        [
          342.33,
          251.78
        ],
        [
          332.51,
          264.53
        ],
        [
          326.38,
          274.0
        ],
        [
          316.35,
          283.87
        ],
        [
          306.45,
          295.55
        ],
        [
          296.6,
          303.41
        ],
        [
          284.63,
          313.75
        ],
        [
          275.27,
          320.59
        ],
        [
          269.48,
          328.89
        ],
        [
          260.81,
          336.59
        ],
        [
          257.28,
          344.02
        ],
        [
          254.42,
          347.59
        ],
        [
          254.57,
          351.69
        ],
        [
          244.58,
          356.31
        ],
        [
          253.72,
          353.36
        ],
        [
          242.77,
          355.92
        ],
        [
          252.71,
          350.97
        ],
        [
          241.47,
          348.34
        ],
        [
          241.93,
          340.51
        ],
        [
          234.88,
          336.19
        ],
        [
          227.46,
          327.55
        ],
        [
          219.19,
          319.86
        ],
        [
          210.37,
          309.41
        ],
        [
          200.97,
          300.97
        ],
        [
          188.99,
          291.86
        ],
        [
          180.03,
          283.25
        ],
        [
          171.92,
          273.91
        ],
        [
          161.24,
          262.53
        ],
        [
          155.19,
          254.66
        ],
        [
          150.74,
          242.32
        ],
        [
          152.42,
          233.12
        ],
        [
          152.05,
          222.39
        ],
        [
          156.92,
          209.17
        ],
        [
          160.49,
          199.85
        ],
        [
          172.23,
          193.52
        ],
        [
          182.13,
          190.99
        ],
        [
          193.0,
          185.41
        ],
        [
          199.06,
          183.82
        ],
        [
          210.32,
          187.47
        ],
        [
          221.98,
          192.75
        ],
        [
          229.89,
          198.52
        ],
        [
          235.83,
          202.68
        ],
        [
          241.41,
          208.52
        ],
        [
          244.09,
          217.13
        ],
        [
          252.64,
          218.92
        ],
        [
          243.35,
          226.69
        ]
      ],
      "closed": true,
      "color": "#FF4D6D",
      "pressure": null
    }
  ],
  "seed": 102,
  "meta": {
    "description": "wonky asymmetric heart",
    "category": "heart",
    "corpus": "golden"
  }
}