{
  "canvas": {
    "width": 512,
    "height": 512
  },
  "strokes": [
    {
      "id": "s1",
      "points": [
        [
          385.64,
          256.0
        ],
        [
          378.88,
          266.5
        ],
        [
          397.42,
          282.36
        ],
        [
          375.96,
          288.59
        ],
        [
          380.92,
          305.36
        ],
        [
          356.91,
          304.73
        ],
        [
          366.08,
          333.17
        ],
        [
          344.57,
          332.26
        ],
        [
          324.36,
          325.82
        ],
        [
          308.91,
          321.22
        ],
        [
          246.0,
          346.79
        ],
        [
          227.87,
          347.59
        ],
        [
          217.1,
          327.15
        ],
        [
          207.75,
          316.06
        ],
        [
          175.99,
          333.09
        ],
        [
          164.13,
          321.49
        ],
        [
          166.31,
          302.32
        ],
        [
          170.78,
          286.66
        ],
        [
          141.32,
          283.21
        ],
        [
          128.63,
          270.87
        ],
        [
          153.94,
          256.0
        ],
        [
          152.38,
          274.14
        ],
        [
          136.86,
          257.63
        ],
        [
          147.99,
          246.05
        ],
        [
          151.61,
          231.14
        ],
        [
          171.84,
          226.67
        ],
        [
          193.55,
          228.25
        ],
        [
          192.41,
          201.87
        ],
        [
          211.27,
          200.48
        ],
        [
          228.07,
          195.44
        ],
        [
          246.0,
          211.29
        ],
        [
          310.41,
          213.2
        ],
        [
          332.77,
          195.48
        ],
        [
          349.12,
          202.6
        ],
        [
          345.35,
          231.66
        ],
        [
          354.81,
          238.95
        ],
        [
          365.03,
          245.88
        ],
        [
          390.85,
          247.34
        ],
        [
          381.63,
          263.74
        ],
        [
          381.63,
          275.15
        ]
      ],
      "closed": true,
      "color": "#C77DFF",
      "pressure": null
    }
  ],
  "seed": 1,
  "meta": {
    "description": "strongly asymmetrical form",
    "category": "asymmetrical"
  }
}