{
  "canvas": {
    "width": 512,
    "height": 512
  },
  "strokes": [
    {
      "id": "head",
      "points": [
        [
          284.94,
          140.0
        ],
        [
          283.53,
          151.4
        ],
        [
          274.27,
          158.27
        ],
        [
          267.47,
          167.7
        ],
        [
          256.0,
          169.44
        ],
        [
          246.04,
          164.03
        ],
        [
          235.23,
          160.77
        ],
        [
          228.87,
          151.24
        ],
        [
          229.4,
          140.0
        ],
        [
          228.18,
          128.48
        ],
        [
          236.63,
          120.63
        ],
        [
          245.37,
          114.33
        ],
        [
          256.0,
          111.31
        ],
        [
          267.04,
          113.34
        ],
        [
          276.58,
          119.42
        ],
        [
          280.95,
          129.67
        ]
      ],
      "closed": true,
      "color": "#333333",
      "pressure": null
    },
    {
      "id": "body",
      "points": [
        [
          255.9,
          167.82
        ],
        [
          254.65,
          299.94
        ]
      ],
      "closed": false,
      "color": "#333333",
      "pressure": null
    },
    {
      "id": "arm_l",
      "points": [
        [
          253.45,
          209.09
        ],
        [
          201.89,
          248.07
        ]
      ],
      "closed": false,
      "color": "#333333",
      "pressure": null
    },
    {
      "id": "arm_r",
      "points": [
        [
          255.6,
          207.22
        ],
        [
          321.43,
          242.6
        ]
      ],
      "closed": false,
      "color": "#333333",
      "pressure": null
    },
    {
      "id": "leg_l",
      "points": [
        [
          254.09,
          301.47
        ],
        [
          219.65,
          380.32
        ]
      ],
      "closed": false,
      "color": "#333333",
      "pressure": null
    },
    {
      "id": "leg_r",
      "points": [
        [
          256.66,
          299.98
        ],
        [
          294.55,
          382.92
        ]
      ],
      "closed": false,
      "color": "#333333",
      "pressure": null
    }
  ],
  "seed": 1,
  "meta": {
    "description": "stick figure",
    "category": "stick_figure"
  }
}